{
  "policy_version": 3,
  "sandbox": "none",
  "sandbox_unsafe_ack": true,
  "network": "disabled",
  "network_unsafe_ack": true,
  "fs": {
    "allowed_read": [
      "/tmp"
    ],
    "allowed_write": [
      "/tmp"
    ],
    "working_dir": "/tmp"
  },
  "fs_write_unsafe_ack": true,
  "fs_strict_write": false,
  "exec": {
    "allowed_executables": [
      "/tmp/audio-extractor"
    ],
    "allow_shell": false
  },
  "env": {
    "allowlist": ["PATH", "HOME", "USER", "TERM", "NO_COLOR"],
    "set": {
      "NO_COLOR": "1"
    },
    "inherit": true
  },
  "budgets": {
    "max_runtime_ms": 30000,
    "max_steps": 100,
    "max_output_bytes": 8388608,
    "max_snapshot_bytes": 2097152,
    "max_wait_ms": 10000
  },
  "artifacts": {
    "enabled": true,
    "dir": "/tmp/audio-extractor-test",
    "overwrite": true
  },
  "replay": {
    "strict": false
  }
}
